SCORE,SaleEnds,description,SaleStarted,LowestPrice,Image,MainStory,platform,URL,Trailer,PercentOff,Completionist,genre,PlusPrice,MexPrice,OpenCriticURL,Title,ESRBRating,Publisher,ReleaseDate,Slug,NumberofPlayers,IsPS5,Price,MainExtra,SalePrice,IsPS4
,2023-03-29,"Idol Manager is a business simulator where you conquer the entertainment industry by using any means necessary. You take on the role of manager at a small (but growing!) talent agency. As you cultivate and train the newest generation of young pop stars, you'll have to decide who to hire and who to fire, who gets promoted and who gets reprimanded. The personal lives of these young celebrities are a part of your business, and the life of a pop star isn't always sunshines and rainbows. Their crowning personal achievements can be your greatest commercial successes, but their emotional meltdowns and PR nightmares can spell financial disaster for your company. It's not just the idols you have to worry about. The world is full of gossip magazines, super fans, and rival groups, all thirsty for a scoop on the latest scandal. There's a lot of people who want to tear you down and are willing to play dirty, but try not to let it get to you. It's nothing personal, it's just business. ?Idol Training Provide voice training and dance lessons to the idols you have scouted, and train them to become top-notch idols. Do you want a cool group or a cute group? Will the office control what they post on social networking sites? Or how long should their skirts be? You decide. ?CD Production Lyrics, musical arrangement, choreography, number of singers per group, who will be front and center? The players themselves will have to make the tough decisions, produce the music and CD, and then release it. Of course, watch how much funds you have before you end up in the red! ?Advertising Activities Your Idol’s work isn't just to sing and dance in concerts. They may appear in magazines, TV, or livestreams on the Internet. Take on a wide variety of media outlets to increase your fan base! ?Office Management In addition to releasing single CDs, you can freely operate a cafe, theater, general elections, program production, and many other types of businesses. However, there is a limit to your funds. Be careful to not become a shoestring operation and watch your revenue! ?Complicated human relations Idol management is fraught with problems, such as scandals, media manipulation, and interpersonal relation issues between idol group members and outsiders. To avoid risks, form good relationships and aim for smooth office management. ?Fascinating Story The story is set in the Japanese entertainment industry, and there are many events outside the main storyline. You can even marry your idol! How this story ends, is entirely up to you. ?Free Play Style Free play with no storyline can also be used to avoid random events and love scandals. There are two unique difficulty levels: Relaxed, where you cannot go bankrupt, and Unfair, which makes it more difficult for players to make ends meet. Overcome various obstacles and create the best idol agency in Japan from the ground up!",2023-03-14,/game/89360,https://image.api.playstation.com/vulcan/ap/rnd/202207/2005/YfugRFILsoOzZTKllO1yyrDb.png?w=200,20,Playstation,https://store.playstation.com/en-tr/product/EP0122-PPSA05841_00-8953178883180872,,30%,25,Simulation,174.3,https://image.api.playstation.com/vulcan/ap/rnd/202207/2005/YfugRFILsoOzZTKllO1yyrDb.png,,Idol Manager,TRD,PLAYISM,2022-08-24,idol-manager-playstation-tr,,1,249,22,174.3,0
,2023-03-29,"So you think you are smarter than a 5th grader? Well, how about we send you back to school for some „Extra Credit“ then? Face new challenges in this mind-twisting and education-defying DLC with 3500+ more questions that add the finishing touch to „Are You Smarter than a 5th Grader“.",2023-03-14,,https://image.api.playstation.com/vulcan/ap/rnd/202206/0807/mFYpN38N3rhlvNwToICEkLRp.png?w=200,,Playstation,https://store.playstation.com/en-tr/product/EP4539-PPSA03676_00-HOMEWORK00000000,,20%,,"Family, Family",79.2,https://image.api.playstation.com/vulcan/ap/rnd/202206/0807/mFYpN38N3rhlvNwToICEkLRp.png,,Extra Credit,TRD,www.handy-games.com GmbH,2022-08-23,extra-credit-playstation-tr,,1,99,,79.2,1
,2023-03-29,"Play your way into the history books in Madden NFL 23! Call the shots in Franchise with free agency and trade logic updates, play your way into the history books in Face of the Franchise: The League, and assemble the most powerful roster in Madden Ultimate Team™. Face of the Franchise: The League In your fifth NFL season at a position of your choice (QB, WR, RB, CB, MLB) you’re seeking a fresh start with a new team. Negotiate a one-year contract and show out with great on-field performance to level up. The addition of New Drive Goals and Drive Summaries allow you to tweak your experience throughout a game and get feedback and rewards based on how well you play. Get performance boosts from weekly activities between games while and strive for the highest level of prestige on your Road to 99. Franchise Utilize refined scouting, staff management, and weekly strategy features to take your Franchise to the top. New athlete motivations like team location and salary demands factor into contract negotiations and add to the drama of NFL free agency. Updated Trade Logic AI represents the value of star players more accurately for fair and more realistic offers. Madden Ultimate Team Develop your dream roster of current NFL superstars, Hall of Fame legends, and more. Always have something to play for with the first-ever Field Pass challenge and reward tracker in Madden Ultimate Team. Play to earn MUT Champions entry tokens and compete at your convenience. Simplified Set building lets you navigate your content binder more effectively so you can focus on improving your Ultimate Team roster all season. This game includes optional in-game purchases of virtual currency that can be used to acquire virtual in-game items, including a random selection of virtual in-game items.",2023-03-14,/game/110803,https://image.api.playstation.com/vulcan/ap/rnd/202302/2810/e7df28e162fcb28b0dea4b9e112347831d0a67a1389d5490.png?w=200,19,Playstation,https://store.playstation.com/en-tr/product/EP0006-CUSA30658_00-MADDENNFL23GAME1,https://www.youtube.com/watch?v=Qv6G_w8RUOo,70%,0,Sports,202020,https://image.api.playstation.com/vulcan/ap/rnd/202302/2810/e7df28e162fcb28b0dea4b9e112347831d0a67a1389d5490.png,,Madden NFL 23 PS4™,TRD,EA Swiss Sarl,2022-08-18,madden-nfl-23-ps4-playstation-tr,,0,700,37,210,1
,2023-03-29,"Super Bullet Break is a one-of-a-kind strategy deck builder filled with a wild bunch of cute and colorful characters – ‘Bullets’ – each and every one of them unique in their own way. Rescue online games from total destruction in a world where online multiplayer games have been taken over by a rogue AI! Can you save the world, defeat enemies in strategic turn-based battles, and beat Super Bullet Break? Collect over 160 Bullets No two girls are alike! Get to know the Bullets you collect along the way, all of them featuring original artwork and character designs, and build the perfect team. Gather a wide variety of items and bullets to make them work together to your advantage! From Common to Legendary, Active to Passive, each item will be useful to you in its own way. Choose Your Character Play as either Akari, Hikaru, or Sumire! Each of them comes with different features and may be of advantage to you depending on your playstyle. Do you prefer a stable playstyle or defeating your enemies with technical combos? Super Bullet Break has a character for everyone. 7 unique game maps From Seasons of Love to The Aquarhythm Deep and Phoenix Gunner, each of the 7 game maps has been inspired by classic game genres from dating sims to rhythm games and dungeon crawlers. Gacha without microtransactions Although inspired by classic gacha games, Super Bullet Break takes the microtransactions out of it! Purchase items in the shop with in-game currency, receive them as a battle reward, or find them in the treasure chests scattered around the map to improve your deck! Super Bullet Break is all about strategy after all … and a little bit of luck. With your character determining your starting deck, it's now up to you to take the risk to swap cartridges, find items, and scout Bullets - a deck builder with a twist, if you will. Improve your strategy with every replay!",2023-03-14,/game/112688,https://image.api.playstation.com/vulcan/ap/rnd/202203/2414/QcUj1aKbIQOlcOBEVXGjPDSC.png?w=200,7,Playstation,https://store.playstation.com/en-tr/product/EP4293-CUSA31615_00-SBBRPS4SIEE00000,https://www.youtube.com/watch?v=fP3kwwVM4MY,30%,0,"Role Playing Games, Strategy, Simulation",139.3,https://image.api.playstation.com/vulcan/ap/rnd/202203/2414/QcUj1aKbIQOlcOBEVXGjPDSC.png,,Super Bullet Break,TRD,PQube Ltd,2022-08-11,super-bullet-break-playstation-tr,,0,199,13,139.3,1
,2023-03-29,"Nezuko Kamado (Advanced Demon Form) will become a playable character. Additional contents such as quotes and profile photos will also be included. [Set Details] ?Playable character: Nezuko Kamado (Advanced Demon Form) ?Profile Photos ?Quotes ?The main game (sold separately) is required to access this content as well as the latest patch. ?This product is also available as part of a set. Be careful not to make duplicate purchases. ?A paid subscription to Nintendo Switch Online is required to play Versus Mode online. ?The content/specs may change without warning. ?Game illustrations for each character are based on the in-game 3D models created by CyberConnect2 Co., Ltd.",2023-03-14,,https://image.api.playstation.com/vulcan/ap/rnd/202207/2718/ijCwBdT5aEHB5V03Nd9a2ifW.png?w=200,,Playstation,https://store.playstation.com/en-tr/product/EP0177-PPSA03490_00-HINOKAMIDLC00006,,30%,,Action,34.3,https://image.api.playstation.com/vulcan/ap/rnd/202207/2718/ijCwBdT5aEHB5V03Nd9a2ifW.png,,Nezuko Kamado (Advanced Demon Form) Character Pack PS4&PS5,TRD,SEGA EUROPE LTD,2022-08-10,nezuko-kamado-advanced-demon-form-character-pack-ps4ps5-playstation-tr,,1,49,,34.3,1
,2023-03-29,"This DLC contains one Legendary Hunter and three Legendary weapons: - The Prescient (one Hunter) - The Forewarning (one weapon) - Moon Bleached (one weapon) Ira Ozols was never blind to the injustice of her life, though she no longer speaks of why. Whatever happened, she was driven to find order, to find a way to balance the odds. The rabbit hole she followed led deeper and deeper into a shadowy sect of the AHA that sought to keep the world’s unpalatable truths covered. As she passed from success to success, the sect assigned her to straighten out one of their wayward sons, Isaac Powell. Powell, now The Night Seer, impressed Ozols with his vision of a world turned upside down. She grew jealous of his foresight and saw the way to achieve the justice she craved: a way to balance the rightness of actions by both their past and future effects. Ozols gained the Night Seer’s trust, and he confided in her the ritual he had undertaken. She repeated it, and as the power coursed through her, it left her blind to the present, but with a powerful and uncanny sense of what was to come. But seeing the Night Seer’s path, more vividly than he himself had ever managed, shocked Ozols. She shredded her white robes and dyed them black. The symbols of power she’d once daubed in blood, she bleached again with the light from the corrupted moon, enriching her affinity for Dark Sight. She tied the scraps around her weapons, sure reminders to keep her path true. Relying on her heightened perception, familiarity with Dark Sight, and uncanny foresight, Ozols now pursues the Night of the Hunter and any who would work towards their goals. In turn, the Night Seer feels the threat of there being one with greater power than himself, and knows that his prophecy will not come true if another has witnessed it. Now, they are locked in a dark duel, each moving two steps ahead of the other. - The Blindside (one weapon)",2023-03-14,,https://image.api.playstation.com/vulcan/ap/rnd/202207/0810/E0KqHn5YwbkajJZAhuW1qzl2.png?w=200,,Playstation,https://store.playstation.com/en-tr/product/EP4291-CUSA15859_00-THEHUNTGAME00043,,30%,,"Shooter, Action, Shooter",69.3,https://image.api.playstation.com/vulcan/ap/rnd/202207/0810/E0KqHn5YwbkajJZAhuW1qzl2.png,,Hunt: Showdown - The Prescient Night,TRD,Crytek Gmbh,2022-07-26,hunt-showdown--the-prescient-night-playstation-tr,,1,99,,69.3,0
,2023-03-29,"Become one man construction crew and build houses like a simple African mud hut and as complex as a super modern energy saving architectural marvel. Let us take you on a trip to various spots on the globe and experience true architectural variety. You will try to build a mud hut in Africa, an igloo in the Arctic, a Canadian house, a log cabin in Siberia, traditional house made of bricks, airbricks or concrete and many, many more… Every house consists of hundreds elements you need to match according to rules of construction. See how the construction technologies differ from each other. Learn how to apply proper materials and procedures during building process. Build houses brick by brick, element after element, down from the foundations and up to the roof. Learn different structures of buildings, construction materials, their features and properties. Build simple constructions made of primitive materials, but also ultramodern buildings featuring the latest technological discoveries. Use various tools depending on the situations and requirements. Improve your skills, use better equipment to be able to build complex structures quickly and efficiently. Sometimes there is no way out. Demolish everyting on you way and start over! ABOUT HOUSE BUILDER Building is your hobby? Thanks to the House Builder you will become a one-man construction crew! Find a perfect piece of land and create something amazing there! Constructing is only limited by your imagination and bank balance… So control your resources, keep up with construction standards and raise buildings that everyone will love! HOUSE BUILDER – MAIN FEATURES: To build a first-class house, start with choosing the perfect location. You can select every place in the world! Boiling Africa, frosty Siberia or tropical Amazon Rainforest? It’s up to you! Next let’s focus on the project - you can create different types of buildings - from miserable little shed to exclusive mansion. This will depend also on the materials you will use. Each of them has different properties. Using a wrong material will cause unpleasant consequences. Prove your cleverness and knowledge to prevent any glitch in construction. By the time your skill will be better and buildings more advanced. When all the pieces are set, it only takes a moment to finish and give a unique look to your house. The buyers will be delighted! MAIN FEATURES Build all over the world - Learn more about the architectural style of the region and let your imagination run wild! Learn new technologies - With every building your skill improves and new technologies will expedite your work. Demolish! - Some of the houses must be cleaned up and rebuilt from scratches. Go back in time - Travel across many periods in history and try to build all iconic designs Diverse climate - scorching and freezing temperatures can be a challenge to sustain. Be aware of dangerous fauna.",2023-03-14,/game/92071,https://image.api.playstation.com/vulcan/ap/rnd/202207/0113/t9MxhVghlhXl1XyMjk25Egse.png?w=200,9,Playstation,https://store.playstation.com/en-tr/product/EP1549-CUSA34633_00-CLABS1HB20220520,,40%,14,"Action, Casual, Simulator",89.4,https://image.api.playstation.com/vulcan/ap/rnd/202207/0113/t9MxhVghlhXl1XyMjk25Egse.png,,House Builder,TRD,PlayWay plc,2022-07-15,house-builder-playstation-tr,,0,149,10,89.4,1
,2023-03-29,"In-game costumes that can be used in Versus Mode. Kimetsu Academy Summer Uniforms are now available for Kimetsu Academy Tanjiro Kamado, Kimetsu Academy Nezuko Kamado, Kimetsu Academy Zenitsu Agatsuma, Kimetsu Academy Inosuke Hashibira, and Kimetsu Academy Giyu Tomioka. ?The main game (sold separately) is required to access this content as well as the latest patch. ?Both the PS4™ and PS5™ versions can be downloaded. ?A paid subscription to PlayStation®Plus is required to play Versus Mode online. ?Characters must first be unlocked in order to use their costumes.",2023-03-14,,https://image.api.playstation.com/vulcan/ap/rnd/202206/2823/LHFA2ujEJsMwya14E4OqBZrV.png?w=200,,Playstation,https://store.playstation.com/en-tr/product/EP0177-PPSA03490_00-HINOKAMIDLC00012,,30%,,Action,34.3,https://image.api.playstation.com/vulcan/ap/rnd/202206/2823/LHFA2ujEJsMwya14E4OqBZrV.png,,Additional Costume Pack - Kimetsu Academy Summer Uniforms,TRD,SEGA EUROPE LTD,2022-07-14,additional-costume-pack--kimetsu-academy-summer-uniforms-playstation-tr,,1,49,,34.3,1
,2023-03-29,"Tengen Uzui will become a playable character. Additional contents such as quotes and profile photos will also be included. [Set Details] ?Playable character: Tengen Uzui ?Profile Photos ?Quotes ?The main game (sold separately) is required to access this content as well as the latest patch. ?This product is also available as part of a set. Be careful not to make duplicate purchases. ?Both the PS4™ and PS5™ versions can be downloaded. ?A paid subscription to PlayStation®Plus is required to play Versus Mode online. ?The content/specs may change without warning. ?Game illustrations for each character are based on the in-game 3D models created by CyberConnect2 Co., Ltd.",2023-03-14,,https://image.api.playstation.com/vulcan/ap/rnd/202206/2900/IaPk0UqdrxMHWxr02TV8eUH6.png?w=200,,Playstation,https://store.playstation.com/en-tr/product/EP0177-PPSA03490_00-HINOKAMIDLC00005,,30%,,Action,34.3,https://image.api.playstation.com/vulcan/ap/rnd/202206/2900/IaPk0UqdrxMHWxr02TV8eUH6.png,,Tengen Uzui Character Pack PS4&PS5,TRD,SEGA EUROPE LTD,2022-07-14,tengen-uzui-character-pack-ps4ps5-playstation-tr,,1,49,,34.3,1
,1990-01-01,"Buy F1® 22: Champions Content Bundle and receive*: • 3 New My Team Icons: Nico Hülkenberg, Mark Webber and Jacques Villeneuve • 2 Drivable Safety Cars, available only in Time Trial Mode: Mercedes-AMG GT Black Series Safety Car and Aston Martin Vantage Safety Car • 18000 PitCoin • F1® 22 Life Starter Pack: Make your space your own with items such as furniture including wall art, and a player t-shirt. • F1® 22 New Era Content: Car livery, Suit, Helmet, Cap, T-shirt (for F1® Life) inspired by the stunning Official Formula 1® 2022 New Era car. Enter the new era of Formula 1® in EA SPORTS™ F1® 22 the official videogame of the 2022 FIA Formula One World Championship™",1989-12-17,,https://image.api.playstation.com/vulcan/ap/rnd/202206/2212/CT639zhEcT3C20RrzdpdAOhd.png?w=200,,Playstation,https://store.playstation.com/en-tr/product/EP0006-PPSA04618_00-DLXUPG0000000000,,35%,,Driving/Racing,130,https://image.api.playstation.com/vulcan/ap/rnd/202206/2212/CT639zhEcT3C20RrzdpdAOhd.png,,F1® 22: Champions Content Bundle,TRD,EA Swiss Sarl,2022-07-01,f1-22-champions-content-bundle-playstation-tr,,1,200,,130,1
,2023-03-29,"Enter the new era of Formula 1® in EA SPORTS™ F1® 22, the official videogame of the 2022 FIA Formula One World Championship™. Take your seat for a new season as redesigned cars and overhauled rules redefine race day, test your skills around the new Miami International Autodrome, and get a taste of the glitz and glamour in F1® Life. Race the stunning new cars of the Formula 1® 2022 season with the authentic lineup of all 20 drivers and 10 teams, and take control of your race experience with new immersive or broadcast race sequences. Create a team and take them to the front of the grid with new depth in the acclaimed My Team career mode, race head-to-head in split-screen, Two-Player Career or in multiplayer, or change the pace by taking supercars from some of the sport’s biggest names to the track in our all-new Pirelli Hot Laps feature. • NEW SEASON, NEW RULES: Race a new era of Formula 1® cars in F1® 22 • RACE DAY, REDEFINED: Take control of your virtual F1® experience with immersive and broadcast options for Pit Stops, Formation Laps, and more • F1® SPRINT: Match the real-world with sprint races at the Emilia-Romagna, Austrian and Sao Paulo Grands Prix™ or enable sprint in custom modes for any race on the calendar • F1® LIFE: Get a taste of the glitz and glamour of Formula 1® This game includes optional in-game purchases of virtual currency that can be used to acquire virtual in-game items.",2023-03-14,/game/107320,https://image.api.playstation.com/vulcan/ap/rnd/202207/1414/pYuqRfjRylVgE8do7jYzMiu3.png?w=200,22,Playstation,https://store.playstation.com/en-tr/product/EP0006-CUSA29431_00-F12022PS4GAME000,https://www.youtube.com/watch?v=K5RLRoRWUds,84%,63,Driving/Racing,202020,https://image.api.playstation.com/vulcan/ap/rnd/202207/1414/pYuqRfjRylVgE8do7jYzMiu3.png,,F1® 22 PS4™,TRD,EA Swiss Sarl,2022-07-01,f1-22-ps4-playstation-tr,,0,700,38,112,1
,2023-03-29,"This product entitles you to download both the digital PS4™ version and the digital PS5™ version of this game. NASCAR 21: Ignition redefines the official video game of the world’s most popular stock car racing series. With incredible graphics and immersive gameplay, NASCAR 21: Ignition brings a whole new level of authenticity and atmosphere to the NASCAR Cup Series. Complete with official drivers, teams and tracks from the 2021 NASCAR Cup Series season, the authentic presentation, including broadcast quality pre-race build up and post-race replays, takes you as close to the real thing as you can get. The handling of the car is a direct representation of how it feels to drive one of these incredible machines, complete with updated track packages that represent the 2021 NASCAR Cup Series schedule. This puts you in the heat of the action as the green flag drops, while a full suite of driver assists make the game accessible to new racers. Either dive straight into the action with Race Now, playing as your favorite official driver from the NASCAR Cup Series, or take on the immersive and engaging career mode as you build your reputation in the sport and battle your way toward the championship. A brand-new Paint Booth offers an unrivalled level of customization allowing you to create your own NASCAR Cup Series paint scheme complete with your own iconic race number. Supporting online multiplayer races, you are never far from a race whether that is in a party with your friends or racing with other players from around the world. · Experience the thrill and atmosphere of the NASCAR Cup Series with official cars, drivers and tracks from the 2021 season · New Paint Booth offers unrivalled customization for your paint scheme · Race online with other players for fun or competitively · Incredible visuals and presentation · True to life vehicle physics and handling with a suite of driver assists available · Immersive Career Mode where you can create your NASCAR legacy If you already own the PS4™ version of this game, you can get the PS5™ digital version at no extra cost and you do not need to purchase this product. Owners of a PS4™ disc copy must insert it into the PS5™ every time they want to download or play the PS5™ digital version. PS4™ game disc owners who buy the PS5™ Digital Edition disc-free console will not be able to get the PS5™ version at no extra cost.",2023-03-14,,https://image.api.playstation.com/vulcan/ap/rnd/202108/0717/GCBHvZ03OBBsMxEk261JtYlk.png?w=200,,Playstation,https://store.playstation.com/en-tr/product/EP0773-PPSA06667_00-NASCAR21IGNITION,,20%,,Driving/Racing,139.3,https://image.api.playstation.com/vulcan/ap/rnd/202108/0717/GCBHvZ03OBBsMxEk261JtYlk.png,,NASCAR 21: Ignition PS4 and PS5,TRD,Motorsport Games,2022-06-22,nascar-21-ignition-ps4-and-ps5-playstation-tr,,1,199,,159.2,1
