SCORE,SaleEnds,description,SaleStarted,LowestPrice,Image,MainStory,platform,URL,Trailer,PercentOff,Completionist,genre,PlusPrice,MexPrice,OpenCriticURL,Title,ESRBRating,Publisher,ReleaseDate,Slug,NumberofPlayers,IsPS5,Price,MainExtra,SalePrice,IsPS4
73,2023-03-29,"In a land plagued by powerful and twisted forces, the condemned Marked Inquisitors take up the hunt. A once-peaceful kingdom is plunged into chaos by encroaching tides of Mages: merciless embodiments of elemental chaos. The Marked Inquisitors, a doomed force of the condemned, once again mobilizes to stand against the existential threat of Magic. A buried secret threatens to bring an ancient empire to utter ruin. As a Marked Inquisitor, you’ll journey through the western frontier: pursuing, hunting, and obliterating the forces of chaos that roam the realm. Craft unique weapons and armor from the otherworldly flesh and bones of the Mages you destroy. Master dozens of unique weapons and runic arts: “safe” manipulations of the corrupt Magic your foes wield. Explore a large and labyrinthine world filled with scavengers, secrets, traps, and powerful guardians. Team up with a fellow Inquisitor for full online co-op and drop-in quickplay online co-op, or engage in fast and chaotic PvP through various factions. You may be bound to the Inquisition, but your choices are yours.",2023-03-14,,https://image.api.playstation.com/vulcan/ap/rnd/202109/2805/3OfHHMHNfNcPznx1fuWQXquT.png?w=200,,Playstation,https://store.playstation.com/en-tr/product/EP0609-PPSA07833_00-0895794101741764,https://www.youtube.com/watch?v=ZnBkp9ascxc,50%,,"Role Playing Games, Action",76.5,https://image.api.playstation.com/vulcan/ap/rnd/202109/2805/3OfHHMHNfNcPznx1fuWQXquT.png,https://www.metacritic.com/game/playstation-5/salt-and-sacrifice,Salt and Sacrifice,TRD,SKA STUDIOS LLC,2022-05-09,salt-and-sacrifice-playstation-tr,https://shope.ee/dU9QzNbN,1,153,,76.5,1
73,2023-03-29,"This product entitles you to download both the digital PS4™ version and the digital PS5™ version of this game. For decades, Team Rainbow has been the shield against the worst global threats imaginable. Now, we face the greatest terror yet: a lethal, mutating alien parasite. • Includes Buddy Pass: Invite 2 friends to play with you for FREE for 14 days. • Play alone or with friends from any platform in this 1- to 3-player co-op PvE FPS. • 69 guns, 25 gadgets, 18 operators with progression levels, 12 large dynamic maps, 13 mutating enemies, and free post-launch content. • Test your skills with 4 adjustable difficulty levels and a thrilling Endgame ranked mode. • Tom Clancy's Rainbow Six® Siege Players: Get 4 EXCLUSIVE Epic gearsets across both games and instantly unlock all 18 Tom Clancy's Rainbow® Six Extraction operators in Tom Clancy's Rainbow Six® Siege. Offer and dates subject to change. Restrictions apply, including availability, technical, and content restrictions. Buddy Pass features may differ. Void where prohibited. More info here: https://ubi.li/BuddyPass. If you already own the PS4™ version of this game, you can get the PS5™ digital version at no extra cost and you do not need to purchase this product. Owners of a PS4™ disc copy must insert it into the PS5™ every time they want to download or play the PS5™ digital version. PS4™ game disc owners who buy the PS5™ Digital Edition disc-free console will not be able to get the PS5™ version at no extra cost.",2023-03-14,/game/68213,https://image.api.playstation.com/vulcan/ap/rnd/202105/1919/TQPQtelumFuvM4njKGjgJHQP.png?w=200,10,Playstation,https://store.playstation.com/en-tr/product/EP0001-PPSA01517_00-STANDARDEDITION0,https://www.youtube.com/watch?v=wZFdBeSNzxw,75%,136,Unique,112.25,https://image.api.playstation.com/vulcan/ap/rnd/202105/1919/TQPQtelumFuvM4njKGjgJHQP.png,https://www.metacritic.com/game/playstation-5/tom-clancys-rainbow-six-extraction,Tom Clancy’s Rainbow Six® Extraction PS4 & PS5,TRD,UBISOFT ENTERTAINMENT SA,2022-01-19,tom-clancys-rainbow-six-extraction-ps4--ps5-playstation-tr,https://shope.ee/6AE7Usv0QV,1,449,47,112.25,1
73,2023-03-29,"Don the PlayStation VR headset* to suit up as the Armored Avenger in an original Iron Man adventure! Tony Stark has retired from making weapons and instead creates technology used to battle evil as Iron Man. After several years as a world-famous Super Hero, Tony is attacked by the mysterious Ghost, a hacker and anti-corporate activist who repurposes old Stark Industries weapons. In her efforts to topple his empire, Ghost attacks Stark’s corporate locations around the world, leading to ever-escalating stakes and a final showdown. Key Features: • Using two PlayStation® Move motion controllers** fire up Iron Man’s Repulsor Jets and blast into the skies with an arsenal of iconic Iron Man gear at your fingertips. • Face off against one of Iron Man’s greatest foes in high stakes, action-packed battles. • Upgrade tech in Tony Stark’s garage to customise Iron Man’s sleek armor and awesome abilities.",2023-03-14,/game/65906,https://image.api.playstation.com/vulcan/img/rnd/202010/2716/8pc2fi23ksuIvi0gEHO5EqV2.png?w=200,7,Playstation,https://store.playstation.com/en-tr/product/EP9000-CUSA16206_00-MIMVRGAME0000001,,50%,12,Action,142,https://image.api.playstation.com/vulcan/img/rnd/202010/2716/8pc2fi23ksuIvi0gEHO5EqV2.png,https://www.metacritic.com/game/playstation-4/marvels-iron-man-vr,Marvel's Iron Man VR,TRD,Sony Interactive Entertainment Europe,2020-07-02,marvels-iron-man-vr-playstation-tr,https://shope.ee/8KIc5TtKym,0,284,7,142,1
73,2023-03-29,"This is not just a game. This is real sim racing. In collaboration with the most prestigious car manufacturers, Assetto Corsa ups the simulation stakes with a focus on pure driving realism, with pin-point accuracy across every aspect of the game. Includes over 90 dream cars from Ferrari, Lotus, McLaren, Pagani, Alfa Romeo, Toyota, Maserati, BMW, Audi, Lamborghini, Ford, Mercedes Benz, and Shelby, all rendered to an obsessive level of detail, each with bespoke handling and performance modelling taken from manufacturer’s real-life data and telemetry. Using laser scanning technology to deliver complete accuracy, Assetto Corsa boasts 24 configurations from 15 legendary circuits, including Silverstone, Nordschleife, Imola, Monza, Barcelona, Spa Francorchamps and Brands Hatch. Includes an advanced physics engine with features never seen on any other racing simulator, such as tyre flat spots, heat cycles, graining and blistering.",2023-03-14,/game/16887,https://image.api.playstation.com/cdn/EP4040/CUSA01797_00/NMcAucyANMnYMNkz6V5vk9f5YXty2mCz.png?w=200,42,Playstation,https://store.playstation.com/en-tr/product/EP4040-CUSA01797_00-ASSETTOCORSAXXXX,https://www.youtube.com/watch?v=Uu5C-apy1uU,80%,165,Driving/Racing,43.8,https://image.api.playstation.com/cdn/EP4040/CUSA01797_00/NMcAucyANMnYMNkz6V5vk9f5YXty2mCz.png,https://www.metacritic.com/game/playstation-4/assetto-corsa,Assetto Corsa,TRD,505 GAMES S.R.L.,2016-08-25,assetto-corsa-playstation-tr,https://shope.ee/3VDMLA24GW,0,219,80,43.8,1
72,2023-03-29,"Batora: Lost Haven is a choice-driven isometric action adventure with RPG elements and a unique duality system affecting combat, story, dialogues, puzzles, and endings, that will make you question the meaning of sacrifice. Throughout Batora: Lost Haven, you will navigate your way through a range of unique alien planets and discover a galaxy in which morals are blurred, and the line between right and wrong is mercilessly thin. Wield unique abilities and perfect different combat styles to defeat deadly foes, solve intricate puzzles, and take on quests from curious alien inhabitants. Every choice you make will shape your journey and forge the way you carry out your final mission... Restoring your Lost Haven. THE CALL OF DESTINY After losing her entire family, Avril has learned to be a survivor. She never imagined what her future would hold. To fulfil her destiny, she must journey across the universe to uncover ancient secrets, while making life-changing decisions. MULTI-LAYERED COMBAT Harness the dual powers of Sun and Moon and leverage the power of your mind and body in frenetic battles against deadly enemies and unearthly foes. CHOOSE YOUR PATH With multiple endings, the choices you make decides the fate of the universe and those who inhabit it. What are you willing to sacrifice for what you love? PUT YOUR MIND TO THE TEST Solve intricate and otherworldly challenges in beautiful atmospheric puzzlescapes.",2023-03-14,/game/88773,https://image.api.playstation.com/vulcan/ap/rnd/202209/2811/cstZfV4G2jr702e7UbRsqWFA.png?w=200,6,Playstation,https://store.playstation.com/en-tr/product/EP4064-PPSA05514_00-5341032569762891,https://www.youtube.com/watch?v=Yt51Y_ltFHQ,33%,12,"Action, Role Playing Games",166.83,https://image.api.playstation.com/vulcan/ap/rnd/202209/2811/cstZfV4G2jr702e7UbRsqWFA.png,https://www.metacritic.com/game/playstation-5/batora-lost-haven,Batora: Lost Haven,TRD,Team 17 Digital LTD,2022-10-19,batora-lost-haven-playstation-tr,https://shope.ee/6KXXgpTzY8,1,249,9,166.83,1
72,2023-03-29,"This product entitles you to download both the digital PS4™ version and the digital PS5™ version of this game. OUTRIDERS is a 1-3 player co-op RPG shooter set in an original, dark and desperate sci-fi universe. As mankind bleeds out in the trenches of Enoch, you’ll create your own Outrider and embark on a journey across the hostile planet. With rich storytelling spanning a diverse world, you’ll leave behind the slums and shanty towns of the First City and traverse forests, mountains and desert in the pursuit of a mysterious signal. Combining intense gunplay with violent powers and an arsenal of increasingly twisted weaponry and gear-sets, OUTRIDERS offers countless hours of gameplay from one of the finest shooter developers in the industry – People Can Fly. Online only, no offline modes If you already own the PS4™ version of this game, you can get the PS5™ digital version at no extra cost and you do not need to purchase this product. Owners of a PS4™ disc copy must insert it into the PS5™ every time they want to download or play the PS5™ digital version. PS4™ game disc owners who buy the PS5™ Digital Edition disc-free console will not be able to get the PS5™ version at no extra cost.",2023-03-14,/game/68276,https://image.api.playstation.com/vulcan/ap/rnd/202207/0814/RZZsDkMAnGL3rIGkMMgtdBUW.png?w=200,16,Playstation,https://store.playstation.com/en-tr/product/EP0082-PPSA01779_00-1955314285649692,https://www.youtube.com/watch?v=kVlzMyPlKek,60%,62,Action,0,https://image.api.playstation.com/vulcan/ap/rnd/202207/0814/RZZsDkMAnGL3rIGkMMgtdBUW.png,https://www.metacritic.com/game/playstation-4/outriders,OUTRIDERS PS4 & PS5,TRD,Square Enix LTD,2021-03-31,outriders-ps4--ps5-playstation-tr,https://shope.ee/9enzfao0uX,1,439,35,175.6,1
72,2023-03-29,"They Are Billions is a Steampunk strategy game set on a post-apocalyptic planet. Build and defend colonies to survive against the billions of infected that seek to annihilate the few remaining living humans. Can humanity survive after the zombie apocalypse? Campaign: The New Empire - Available now! Highlights: - Real time with pause and thousands of units on screen - Campaign with 48 missions, more than 60 hours of gameplay *Destroy the swarms of infected with the Imperial Army *Make your colonies evolve with more than 90 available technologies *Explore the ancient human fortresses with your Hero - Survival strategy game with randomly generated maps - Weekly Challenge with Leaderboard - Mouse and Keyboard Support Be prepared to resist the attack of huge swarms of up to 20,000 infected, don’t let them take over your colony!",2023-03-14,/game/51685,https://image.api.playstation.com/vulcan/img/cfn/11307_GjpMAFGJ9atc5inoHIhu_53g2IGlyhaAZoxDdjHY4UYY_o6Atc8y4OukVjD300BMc_SxGzFFkJfX042_cPi-sQ9kJa.png?w=200,62,Playstation,https://store.playstation.com/en-tr/product/EP0958-CUSA13330_00-THEYAREBILLIONS0,https://www.youtube.com/watch?v=4MmFslPILuM,70%,162,"Strategy, Strategy, Strategy",71.25,https://image.api.playstation.com/vulcan/img/cfn/11307_GjpMAFGJ9atc5inoHIhu_53g2IGlyhaAZoxDdjHY4UYY_o6Atc8y4OukVjD300BMc_SxGzFFkJfX042_cPi-sQ9kJa.png,https://www.metacritic.com/game/playstation-4/they-are-billions,They Are Billions,TRD,BLITWORKS SL,2019-07-08,they-are-billions-playstation-tr,https://shope.ee/2feFLEsrr6,0,285,98,85.5,1
72,2023-03-29,"In addition, on PS5™ consoles: PlayStation Camera adaptor for PS Camera is required (no purchase necessary) go to Playstation.com/camera-adaptor. The iconic shooter-looter gets in your face! Virtually immerse yourself in the untamed world of Borderlands. Step into the boots of a treasure-seeking Vault Hunter armed with 87 bazillion guns on a quest to line your pockets with loot. Blast bandits with real-world aiming, punch psychos in the mouth, race across the desert in stolen bandit vehicles and free Pandora from Handsome Jack’s clutches! PUT ON YOUR VIRTUAL BOOTS Become one of four playable classes: Siren, Commando, Gunzerker and Assassin, each with unique skillsets and combat styles! GET VIRTUALLY LOADED Shoot-and-loot with bazillions of procedurally-generated guns, each with their own capabilities and modifiers. Plus, lust after procedurally-generated shields, grenades, relics, class mods and more for maximum power and mayhem! VIRTUALLY SLOW TIME Use the new Slow-Mo ability to set up your next attack! Plus, with Teleport, glide across Pandora as gracefully as Claptrap, if he had grace.",2023-03-14,/game/65705,https://image.api.playstation.com/cdn/EP1001/CUSA13946_00/AvWXn0T9OUf4HtR3NGbMBp5tUvZfabCV.png?w=200,0,Playstation,https://store.playstation.com/en-tr/product/EP1001-CUSA13946_00-000000000000BLVR,,50%,98,"Action, Action, Shooter",237.5,https://image.api.playstation.com/cdn/EP1001/CUSA13946_00/AvWXn0T9OUf4HtR3NGbMBp5tUvZfabCV.png,https://www.metacritic.com/game/playstation-4/borderlands-2-vr,Borderlands 2 VR,TRD,2K,2018-12-13,borderlands-2-vr-playstation-tr,https://shope.ee/7f2vIYjwDx,0,475,0,237.5,1
72,2023-03-29,"Jotun is a hand-drawn action-exploration game set in Norse mythology. In Jotun, you play Thora, a Viking warrior who died an inglorious death and must prove herself to the Gods to enter Valhalla. Explore vast regions of Norse Purgatory to find runes to unleash the jotun, giant Norse elementals. Fight them using only your massive two-handed axe, the blessings of the Gods and your skills! Jotun: Valhalla Edition features the brand new Valhalla Mode, the ultimate battle against even fiercer versions of the Jotun! A true challenge for those who wish to impress the Gods! Features: - Experience beautiful hand-drawn animation - Fight five epic jotuns, giant Norse elementals - Explore nine vast and mysterious levels filled with Viking mythology - Learn about Thora's life and death in an overarching story - Summon powers bestowed upon you by the Viking Gods - Hear authentic Icelandic voice-overs 1 player 4GB minimum save size Remote Play Supported HD Video Output 720p,1080i,1080p Download of this product is subject to the PlayStation Network Terms of Service and our Software Usage Terms plus any specific additional conditions applying to this product. If you do not wish to accept these terms, do not download this product. See Terms of Service for more important information. One-time licence fee to download to multiple PS4 systems. Sign in to PlayStation Network is not required to use this on your primary PS4, but is required for use on other PS4 systems. See Health Warnings for important health information before using this product. Library programs ©Sony Computer Entertainment Inc. exclusively licensed to Sony Computer Entertainment Europe. Software Usage Terms apply, See eu.playstation.com/legal for full usage rights. ©2014-2016 Thunder Lotus Games. All Rights Reserved. Jotun, Thunder Lotus Games and Jotun: Valhalla Edition are trademarks of Thunder Lotus Games in the U.S. and in other countries.",2023-03-14,,https://image.api.playstation.com/cdn/EP2251/CUSA05293_00/kaeS7yn0qIMN53tw8WMYqYKfUs8BM62F.png?w=200,,Playstation,https://store.playstation.com/en-tr/product/EP2251-CUSA05293_00-JOTUNVALHALLAED1,https://www.youtube.com/watch?v=QgKTEz5vCgQ,75%,,"Action, Adventure, Unique",0,https://image.api.playstation.com/cdn/EP2251/CUSA05293_00/kaeS7yn0qIMN53tw8WMYqYKfUs8BM62F.png,https://www.metacritic.com/game/playstation-4/jotun-valhalla-edition,Jotun: Valhalla Edition,TRD,Thunder Lotus Games,2016-09-09,jotun-valhalla-edition-playstation-tr,https://shope.ee/9UUZUBEl8K,0,144,,36,1
71,2023-03-29,"THIS WORLD COMES FOR YOU Ride into a desperate dog-eat-dog world ravaged by a deadly pandemic as drifter and bounty hunter, Deacon St. John. Risk the threats of the broken road on the back of your trusty drifter bike as you face swarms of mindless feral Freakers – and equally terrifying humans. Unpredictable weather and different times of day and night can cause incredible danger and shocking surprises… and everything wants you dead. • Harsh open world: explore incredibly realistic vast and hostile regions of the Pacific Northwest. • Brutal sandbox combat: devise your strategies as you customise weapons and skills, craft traps and upgrade your bike. • Compelling story: survive an unforgiving wilderness as you search for a reason to live after suffering a deep, personal loss.",2023-03-14,/game/38003,https://image.api.playstation.com/vulcan/img/rnd/202011/1204/wYL4v2r8uMQFvVTJlfuj8ICk.png?w=200,36,Playstation,https://store.playstation.com/en-tr/product/EP9000-CUSA09175_00-DAYSGONECOMPLETE,https://www.youtube.com/watch?v=lUizh9drzmI,60%,64,"Action, Adventure, Horror",0,https://image.api.playstation.com/vulcan/img/rnd/202011/1204/wYL4v2r8uMQFvVTJlfuj8ICk.png,https://www.metacritic.com/game/playstation-4/days-gone,Days Gone™,TRD,Sony Interactive Entertainment Europe,2019-04-25,days-gone-playstation-tr,https://shope.ee/5ALaJt8frs,0,349,50,139.6,1
71,2023-03-29,"Feel the adrenaline and experience the most complete racing ever with RIDE 3! Immerse yourself in a modern 3D environment where you will compete side by side with your bike, modifying it mechanically and aesthetically thanks to the new Livery Editor, which will let your dreams run wild. Before starting, don't forget to customise your rider with the right outfit. Race on 30 different tracks all over the world and test out the speed of more than 230 bikes available. Discover the new Volumes career mode, which will give you maximum freedom of choice and the best bikes from the most famous manufacturers. What are you waiting for? Start your adventure with RIDE 3.",2023-03-14,/game/67013,https://image.api.playstation.com/cdn/EP4356/CUSA10100_00/3CfQThdCzXZEDqGI4aoWe0Csp8PVpVZt.png?w=200,71,Playstation,https://store.playstation.com/en-tr/product/EP4356-CUSA10100_00-RIDE3FULLGAME000,https://www.youtube.com/watch?v=fSLPnHjCm10,85%,164,Driving/Racing,43.9,https://image.api.playstation.com/cdn/EP4356/CUSA10100_00/3CfQThdCzXZEDqGI4aoWe0Csp8PVpVZt.png,https://www.metacritic.com/game/playstation-4/ride-3,RIDE 3,TRD,MILESTONE SRL,2018-11-29,ride-3-playstation-tr,https://shope.ee/9zQq4rEaGm,0,439,104,65.85,1
71,2023-03-29,"Long ago, a war raged between two powerful deities. Each was sealed away, and now fighters seek their hidden weapons. By chance, Fang is unwillingly embroiled in the battle, and now must choose which deity to awaken in this RPG! Key Features 1. In the three stories to play, friends become foes, foes become friends, and, based on your choices, multiple endings can be unlocked! 2. Customize weapons by fusing them with fairies and change dungeons stats through World-Shaping. Even transform with the “Fairize” skill and become stronger in battle! 3. With up to six party members on the battlefield at a time, you can play as all your favorite Fencers! 4. Play in Easy, Normal, or Hard mode and switch the difficulty to suit your play style! This product supports the following languages: English",2023-03-14,/game/38952,https://image.api.playstation.com/cdn/EP0031/CUSA04853_00/CutsSvJOndLHuJvbHMjs2h6AdjQ2W3Dc.png?w=200,26,Playstation,https://store.playstation.com/en-tr/product/EP0031-CUSA04853_00-FFFADF0000000EU1,https://www.youtube.com/watch?v=IcSlZyDDNcc,70%,63,Role-Playing,59.7,https://image.api.playstation.com/cdn/EP0031/CUSA04853_00/CutsSvJOndLHuJvbHMjs2h6AdjQ2W3Dc.png,https://www.metacritic.com/game/playstation-4/fairy-fencer-f-advent-dark-force,Fairy Fencer F: Advent Dark Force,TRD,Idea Factory International Inc.,2016-07-28,fairy-fencer-f-advent-dark-force-playstation-tr,https://shope.ee/4KmTKiTMGm,0,199,37,59.7,1
70,2023-03-29,"Welcome to a new era of dance with Just Dance® 2023 Edition! For the first time ever, dance to BTS with Dynamite and other top chart hits! Now with new online multiplayer, personalization, 3D immersive worlds, and new songs and modes year-round,* you can experience a never-ending dance party all year long! • Online multiplayer: Now you can play Just Dance with whoever you want, wherever they are. Host a Private Group and invite up to five other players from your Friends list to join and play like you’re all in the same living room! • New user interface: Thanks to a new, more modern, and intuitive user interface, everything is one click away: playlists, game modes, and songs! More time dancing, less time searching! • Personalized experiences: Get a personalized experience with custom-made sessions and songs tailored to your preferences and playing habits. Also keep track of your progress on your account and keep tab of your scores! Just Dance 2023 Edition includes a one-month free trial of Just Dance®+ *Additional content made available on a rolling basis for a limited time during the 12 months following launch of the game; download required. **Just Dance+ is a streaming service, playable via Just Dance® 2023 Edition, that grants access to additional songs. Terms and conditions apply. Requires the connection to a Ubisoft Account (13+), permanent internet access and the payment of a fee. Auto-renewal may be activated during the purchase. Age and territorial restrictions may apply. Applicable platform account and platform subscription (sold separately) required. Persistent internet connection and Ubisoft account required.",2023-03-14,/game/117948,https://image.api.playstation.com/vulcan/ap/rnd/202210/2013/QPtX7W4In4JOHhQ5LipcLqfY.png?w=200,0,Playstation,https://store.playstation.com/en-tr/product/EP0001-PPSA07251_00-JDNEXTY1BUNDLE01,https://www.youtube.com/watch?v=rVrRR7pMHTk,50%,0,"Casual, Family",249.5,https://image.api.playstation.com/vulcan/ap/rnd/202210/2013/QPtX7W4In4JOHhQ5LipcLqfY.png,https://www.metacritic.com/game/playstation-5/just-dance-2023-edition,Just Dance® 2023 Edition,TRD,UBISOFT ENTERTAINMENT SA,2022-11-21,just-dance-2023-edition-playstation-tr,https://shope.ee/6pToHcrndo,1,499,0,249.5,0
70,2023-03-29,"[Fly Around Areas Freely] In STAR OCEAN THE DIVINE FORCE, characters can freely move in 360° degrees and roam the skies. [Move and explore freely in three dimensions: everything you see can be explored!] You can move in three dimensions whilst flying around the largest environment ever. Whether you’re flying around and exploring rockfaces and roofs of buildings in the city, or leaping off cliffs to seamlessly enter battles, you’ll have more freedom in terms of both adventuring and battling. [The Fastest and Strongest Action of any in the Series.] While the game will give you space to play as you please, the scope of its battles has also evolved. Characters can subdue a large number of enemies with super high-speed movement attacks, special abilities where you can vanish for a brief moment from right in front of your enemies’ eyes, and a skill which could kill in one hit! This game will feature a challenging yet thrilling battle experience to enjoy while freely soaring in the skies.",2023-03-14,,https://image.api.playstation.com/vulcan/ap/rnd/202209/1600/o4WCMyXVpIvCAFQAQQ6MGcO7.png?w=200,,Playstation,https://store.playstation.com/en-tr/product/EP0082-PPSA06251_00-STAROCEAN6PS5000,https://www.youtube.com/watch?v=lwlduVD_aqc,40%,,Role-Playing,359.4,https://image.api.playstation.com/vulcan/ap/rnd/202209/1600/o4WCMyXVpIvCAFQAQQ6MGcO7.png,https://www.metacritic.com/game/playstation-4/star-ocean-the-divine-force,STAR OCEAN THE DIVINE FORCE,TRD,Square Enix LTD,2022-10-26,star-ocean-the-divine-force-playstation-tr,https://shope.ee/4KmTJ7uUfB,1,599,,359.4,1
