SCORE,SaleEnds,description,SaleStarted,LowestPrice,Image,MainStory,platform,URL,Trailer,PercentOff,Completionist,genre,PlusPrice,MexPrice,OpenCriticURL,Title,ESRBRating,Publisher,ReleaseDate,Slug,NumberofPlayers,IsPS5,Price,MainExtra,SalePrice,IsPS4
,2023-03-29,"Shape Your Legend in EA SPORTS™ UFC® 4. Heavy Hitters Update: Get into EA SPORTS UFC 4 today and receive the new Heavy Hitters Fighter Update. Update includes: • Alex Pereira • Taila Santos • Rafael Fiziev Purchase EA SPORTS UFC® 4 Deluxe Edition today and receive: - Tyson Fury - Anthony Joshua - Bruce Lee (all weightclasses) - Brock Lesnar - Starter Bundle (500 UFC Points, x1 Jean Shorts, x2 Tank Tops, Backyard Player Card Backgound). In EA SPORTS UFC 4 the fighter you become is shaped by your fight style, your achievements, and your personality. No matter how or where you play EA SPORTS UFC 4 puts ‘you’ at the center of every fight. This game includes optional in-game purchases of virtual currency that can be used to acquire aesthetic customizations.",2023-03-14,,https://image.api.playstation.com/vulcan/ap/rnd/202303/1009/a49f88ee07050557b4e2cb78c6d61e0565de5ee4bdb52666.png?w=200,,Playstation,https://store.playstation.com/en-tr/product/EP0006-CUSA14209_00-DELUXEEDITION000,,80%,,Unique,111.99,https://image.api.playstation.com/vulcan/ap/rnd/202303/1009/a49f88ee07050557b4e2cb78c6d61e0565de5ee4bdb52666.png,,UFC® 4 Deluxe Edition,TRD,EA Swiss Sarl,2020-11-19,ufc-4-deluxe-edition-playstation-tr,,0,559.99,,111.99,1
,2023-03-29,"Buy this digital PS5™ version of Call of Duty®: Black Ops Cold War from the Playstation®Store and download the PS4™ version at no extra cost. Includes: - Cross Gen Bundle of Call of Duty®: Black Ops Cold War game -- Includes PS5™ version of game and PS4™ version - Confrontation Weapons Pack - includes 2 weapon blueprints - Legendary Captain Price Operator Skin* Black Ops Cold War drops you into the volatile geopolitical battle of the early 1980s. In a gripping single-player Campaign, where players will come face-to-face with historical figures and hard truths, as they battle around the globe through iconic locales like East Berlin, Vietnam, Turkey, Soviet KGB headquarters and more. If you already own the PS4™ version of this game, you can get the PS5™ digital version for a discounted price and you do not need to purchase this product. Owners of a PS4™-disc copy must insert it into the PS5™ every time they want to download or play the PS5™ digital version. PS4™-game-disc owners who buy the PS5™ Digital Edition disc-free console will not be able to get the PS5™ version for the discounted price.",2023-03-14,,https://image.api.playstation.com/vulcan/img/rnd/202111/2000/vDTX1PFjQfaEuC6LxpiFrljo.png?w=200,,Playstation,https://store.playstation.com/en-tr/product/EP0002-PPSA02050_00-CODCWTHEGAME0001,,60%,,Shooter,267.6,https://image.api.playstation.com/vulcan/img/rnd/202111/2000/vDTX1PFjQfaEuC6LxpiFrljo.png,,Call of Duty®: Black Ops Cold War - Cross-Gen Bundle PS4™ & PS5™,TRD,Activision Blizzard Int'l BV,2020-11-12,call-of-duty-black-ops-cold-war--crossgen-bundle-ps4--ps5-playstation-tr,,1,669,,267.6,1
,2023-03-29,"Includes: - Call of Duty®: Black Ops Cold War game -- Includes PS4™ version of game -- Plays on PS5™ via backward compatibility - Confrontation Weapons Pack - includes 2 weapon blueprints - Legendary Captain Price Operator Skin* Black Ops Cold War, the direct sequel to Call of Duty®: Black Ops, will drop fans into the depths of the Cold War’s volatile geopolitical battle of the early 1980s. Nothing is ever as it seems in a gripping single-player Campaign, where players will come face-to-face with historical figures and hard truths, as they battle around the globe through iconic locales like East Berlin, Vietnam, Turkey, Soviet KGB headquarters and more.",2023-03-14,,https://image.api.playstation.com/vulcan/img/rnd/202111/2000/9Txj4PhgwnB1U0oKbHZP9h1A.png?w=200,,Playstation,https://store.playstation.com/en-tr/product/EP0002-CUSA24267_00-CODCWSTANDARD001,,67%,,Shooter,197.67,https://image.api.playstation.com/vulcan/img/rnd/202111/2000/9Txj4PhgwnB1U0oKbHZP9h1A.png,,Call of Duty®: Black Ops Cold War - Standard Edition,TRD,Activision Blizzard Int'l BV,2020-11-12,call-of-duty-black-ops-cold-war--standard-edition-playstation-tr,,0,599,,197.67,1
,2023-03-29,"Enhance your Assassin's Creed Valhalla experience with the Season Pass which includes: - The exclusive bonus mission The Legend of Beowulf: Uncover the monstrous truth behind the legend of Beowulf. - Wrath of the Druids Expansion: Journey to Ireland and unravel the mysteries of an ancient druidic cult. Fight your way through haunted forests and dazzling landscapes while gaining influence among Gaelic kings. - The Siege of Paris Expansion: Relive the most ambitious battle in Viking history. Infiltrate the fortified city of Paris, uncover enemy secrets, and form strategic alliances. All included content will be delivered by Nov 9, 2021 Save money on content for this game by purchasing the Season Pass. Content can be downloaded from the PlayStation®Store or in-game once it is released.",2023-03-14,,https://image.api.playstation.com/vulcan/ap/rnd/202010/1413/DkHauUpfoigOaG39f7Ph2lud.png?w=200,,Playstation,https://store.playstation.com/en-tr/product/EP0001-PPSA01490_00-EXPANSIONPASS000,,50%,,Unique,189.5,https://image.api.playstation.com/vulcan/ap/rnd/202010/1413/DkHauUpfoigOaG39f7Ph2lud.png,,Assassin's Creed® Valhalla – Season Pass,TRD,UBISOFT ENTERTAINMENT SA,2020-11-11,assassins-creed-valhalla--season-pass-playstation-tr,,1,379,,189.5,1
,2023-03-29,"Punch your ticket to a host of incredible DIRT 5 perks and content by upgrading to the Year 1 Edition. Celebrate the festive period in style with the Snow Limits pack for DIRT 5, available for free to all players! Included as part of the latest game update, the Snow Limits pack contains an array of festive new objects to use in DIRT 5's Playgrounds mode, a brand new Sprint race event on the ice at Roosevelt Island, and some fresh customisation options for your profile and liveries, including holiday liveries for the Ford Mustang GT4 and Porsche Cayenne Transsyberia. Year 1 Edition players have instant access to three ready-to-race cars in their garage (Ariel Nomad Tactical, Audi TT Safari, Volkswagen Beetle Rallycross), three-player sponsors with fresh objectives, rewards and liveries, and boosts to currency and XP earnings. After launch, we are committed to developing a massive selection of new show-stopping moments, and new ways to truly Let Loose. Year 1 Edition players get access to all DIRT 5 content in the 12 months after launch, including a minimum of 12 new cars, 60 new Career events, new player sponsors, rewards, liveries, and more! Grabbing DIRT 5: Year 1 Edition ensures you have the keys to everything the boldest, bravest off-road racing game has to offer at launch, and are first in line for everything we create in Year 1! Not only that, but purchase DIRT 5 on PlayStation®4 and receive the enhanced, optimised PlayStation®5 version for free! The PlayStation®5 Digital Edition requires a digital version of DIRT 5 for the upgrade. ",2023-03-14,,https://image.api.playstation.com/vulcan/ap/rnd/202010/2110/8ZEssUZl5TmCSdAV5C8mZuyY.png?w=200,,Playstation,https://store.playstation.com/en-tr/product/EP4001-PPSA01551_00-YRONEUPGRADEBUND,,70%,,Driving/Racing,100.5,https://image.api.playstation.com/vulcan/ap/rnd/202010/2110/8ZEssUZl5TmCSdAV5C8mZuyY.png,,DIRT 5 - Year One Upgrade,TRD,ELECTRONIC ARTS,2020-11-11,dirt-5--year-one-upgrade-playstation-tr,,1,335,,100.5,1
,2023-03-29,"Red Orbs can be used in Devil May Cry 5 Special Edition to acquire new skills and power up your characters, as well as letting you go back into battle after you lose. Note: Purchased Red Orbs are saved to your save data, and so will be unrecoverable if you delete your save data. The maximum number of Red Orbs you can have is 99,999,999, and additional orbs above this number will not be added. These orbs will not count towards your records, and will not be reflected if you are playing Bloody Palace. Compatible only with Devil May Cry 5 Special Edition.",2023-03-14,,https://image.api.playstation.com/vulcan/img/rnd/202011/1005/6hxu1bcmRfpaHj0po9dab53j.png?w=200,,Playstation,https://store.playstation.com/en-tr/product/EP0102-PPSA01443_00-REDORB0000000000,,50%,,"Action, Unique",9.5,https://image.api.playstation.com/vulcan/img/rnd/202011/1005/6hxu1bcmRfpaHj0po9dab53j.png,,"DMC5SE - 100,000 Red Orbs",TRD,CE EUROPE LIMITED,2020-11-11,dmc5se--100000-red-orbs-playstation-tr,,1,19,,9.5,0
,2023-03-29,Blue Orbs can be used in Devil May Cry 5 Special Edition to increase your maximum health gauge by one segment. Note: The maximum number of Blue Orbs you can acquire thruogh gameplay is 14. Purchasing additional Blue Orbs above this number will not have any effect. Compatible only with Devil May Cry 5 Special Edition.,2023-03-14,,https://image.api.playstation.com/vulcan/img/rnd/202011/1005/89qetlEqxCLZ46JRG0Ir4lbD.png?w=200,,Playstation,https://store.playstation.com/en-tr/product/EP0102-PPSA01443_00-DMC5DLCBLUEORB01,,20%,,Action,8,https://image.api.playstation.com/vulcan/img/rnd/202011/1005/89qetlEqxCLZ46JRG0Ir4lbD.png,,DMC5SE - 1 Blue Orb,TRD,CE EUROPE LIMITED,2020-11-11,dmc5se--1-blue-orb-playstation-tr,,1,10,,8,0
,2023-03-29,Blue Orbs can be used in Devil May Cry 5 Special Edition to increase your maximum health gauge by one segment. Note: The maximum number of Blue Orbs you can acquire thruogh gameplay is 14. Purchasing additional Blue Orbs above this number will not have any effect. Compatible only with Devil May Cry 5 Special Edition.,2023-03-14,,https://image.api.playstation.com/vulcan/img/rnd/202011/1005/O95ncaCjpIswvMx4ZrapYWM8.png?w=200,,Playstation,https://store.playstation.com/en-tr/product/EP0102-PPSA01443_00-DMC5DLCBLUEORB02,,20%,,Action,15.2,https://image.api.playstation.com/vulcan/img/rnd/202011/1005/O95ncaCjpIswvMx4ZrapYWM8.png,,DMC5SE - 3 Blue Orbs,TRD,CE EUROPE LIMITED,2020-11-11,dmc5se--3-blue-orbs-playstation-tr,,1,19,,15.2,0
,2023-03-29,Blue Orbs can be used in Devil May Cry 5 Special Edition to increase your maximum health gauge by one segment. Note: The maximum number of Blue Orbs you can acquire thruogh gameplay is 14. Purchasing additional Blue Orbs above this number will not have any effect. Compatible only with Devil May Cry 5 Special Edition.,2023-03-14,,https://image.api.playstation.com/vulcan/img/rnd/202011/1005/r0oDDFNPACNhftwst8qdrtw3.png?w=200,,Playstation,https://store.playstation.com/en-tr/product/EP0102-PPSA01443_00-DMC5DLCBLUEORB03,,20%,,Action,23.2,https://image.api.playstation.com/vulcan/img/rnd/202011/1005/r0oDDFNPACNhftwst8qdrtw3.png,,DMC5SE - 5 Blue Orbs,TRD,CE EUROPE LIMITED,2020-11-11,dmc5se--5-blue-orbs-playstation-tr,,1,29,,23.2,0
,2023-03-29,"Instantly unlocks the following content which is otherwise earned through gameplay. - Super Character 4-Pack (normally acquired as a completion reward for DANTE MUST DIE mode) - Taunt Quartet (normally costs 12,000,000 Red Orbs) - V & Vergil Alt Colors Note: Super Characters can be used from mission 2 onwards. This content can be purchased separately. Note: Cannot be used with Devil May Cry 5",2023-03-14,,https://image.api.playstation.com/vulcan/ap/rnd/202010/1903/NyD3uw3Dt01GDlDHWmba5pXh.png?w=200,,Playstation,https://store.playstation.com/en-tr/product/EP0102-PPSA01443_00-DMC5BUNDLE000SE1,,20%,,"Action, Unique",79.2,https://image.api.playstation.com/vulcan/ap/rnd/202010/1903/NyD3uw3Dt01GDlDHWmba5pXh.png,,DMC5SE - Complete In-game Unlock Bundle,TRD,CE EUROPE LIMITED,2020-11-11,dmc5se--complete-ingame-unlock-bundle-playstation-tr,,1,99,,79.2,0
,2023-03-29,"Instantly unlocks this content, which is normally acquired as a completion reward for DANTE MUST DIE mode. Super Vergil is also sold separately. Note: Cannot be used with Devil May Cry 5",2023-03-14,,https://image.api.playstation.com/vulcan/ap/rnd/202010/1408/TuTiqYHagweNGiQQg6J4WOzC.png?w=200,,Playstation,https://store.playstation.com/en-tr/product/EP0102-PPSA01443_00-DMC5DLCCHARA0003,,20%,,"Action, Unique",63.2,https://image.api.playstation.com/vulcan/ap/rnd/202010/1408/TuTiqYHagweNGiQQg6J4WOzC.png,,DMC5SE - Super Character 4-Pack,TRD,CE EUROPE LIMITED,2020-11-11,dmc5se--super-character-4pack-playstation-tr,,1,79,,63.2,0
,2023-03-29,Instantly unlocks the following content which is otherwise earned through gameplay. - Super Vergil playable character A separate pack of all four Super Characters is also available. Note: Cannot be used with Devil May Cry 5,2023-03-14,,https://image.api.playstation.com/vulcan/ap/rnd/202010/1407/Mb9jcAnxUehVuYvtszypcGsn.png?w=200,,Playstation,https://store.playstation.com/en-tr/product/EP0102-PPSA01443_00-DMC5DLCCHARA0002,,20%,,"Action, Unique",23.2,https://image.api.playstation.com/vulcan/ap/rnd/202010/1407/Mb9jcAnxUehVuYvtszypcGsn.png,,DMC5SE - Super Vergil Unlock,TRD,CE EUROPE LIMITED,2020-11-11,dmc5se--super-vergil-unlock-playstation-tr,,1,29,,23.2,0
,2023-03-29,"Instantly unlocks this content, which normally costs 12,000,000 Red Orbs. These taunts allow you to increase your Style rank more easily. Vergil's EX Provocation is also sold separately. Note: Cannot be used with Devil May Cry 5",2023-03-14,,https://image.api.playstation.com/vulcan/ap/rnd/202010/1409/Wj1geJpVFBQEGyYCJCz9zPHs.png?w=200,,Playstation,https://store.playstation.com/en-tr/product/EP0102-PPSA01443_00-DMC5DLCTAUNT0003,,20%,,"Action, Unique",55.2,https://image.api.playstation.com/vulcan/ap/rnd/202010/1409/Wj1geJpVFBQEGyYCJCz9zPHs.png,,DMC5SE - Taunt Quartet,TRD,CE EUROPE LIMITED,2020-11-11,dmc5se--taunt-quartet-playstation-tr,,1,69,,55.2,0
,2023-03-29,Allows you to change the battle music to Vergil themes from across the series. Please note that these tracks are also unlockable through gameplay. Track 1: BATTLE-1(VERGIL) Track 2: Beowulf Battle Track 3: Let's Just See Track 4: "DEVILS NEVER CRY" HR/HM Ver. Note: Cannot be used with Devil May Cry 5,2023-03-14,,https://image.api.playstation.com/vulcan/ap/rnd/202010/1403/8VqahhP8KZtOSLMLmVt9RMBQ.png?w=200,,Playstation,https://store.playstation.com/en-tr/product/EP0102-PPSA01443_00-DMC5DLCBGM000005,,20%,,"Action, Unique",15.2,https://image.api.playstation.com/vulcan/ap/rnd/202010/1403/8VqahhP8KZtOSLMLmVt9RMBQ.png,,DMC5SE - Vergil Battle Track 4-Pack,TRD,CE EUROPE LIMITED,2020-11-11,dmc5se--vergil-battle-track-4pack-playstation-tr,,1,19,,15.2,0
,2023-03-29,"Instantly unlocks this content, which normally costs 3,000,000 Red Orbs. This taunt allows you to increase your Style rank more easily. A separate pack of all four EX Provocations is also available. Note: Cannot be used with Devil May Cry 5",2023-03-14,,https://image.api.playstation.com/vulcan/ap/rnd/202010/1408/ycWOMEsIjajbBdxV0jdjx6ZZ.png?w=200,,Playstation,https://store.playstation.com/en-tr/product/EP0102-PPSA01443_00-DMC5DLCTAUNT0002,,20%,,"Action, Unique",15.2,https://image.api.playstation.com/vulcan/ap/rnd/202010/1408/ycWOMEsIjajbBdxV0jdjx6ZZ.png,,DMC5SE - Vergil EX Provocation,TRD,CE EUROPE LIMITED,2020-11-11,dmc5se--vergil-ex-provocation-playstation-tr,,1,19,,15.2,0
,2023-03-29,Instantly unlocks V & Vergil Alt Colors. Note: V's colors can be changed on the character selection screen. Vergil's colors can be changed in Options ? Cutscene Customize. Refunds will not be offered for duplicate purchases. Note: Cannot be used with Devil May Cry 5,2023-03-14,,https://image.api.playstation.com/vulcan/ap/rnd/202010/1406/OQzvduYSa20kZZFZClmst3lH.png?w=200,,Playstation,https://store.playstation.com/en-tr/product/EP0102-PPSA01443_00-DMC5DLCCOLOR0004,,20%,,Action,15.2,https://image.api.playstation.com/vulcan/ap/rnd/202010/1406/OQzvduYSa20kZZFZClmst3lH.png,,DMC5SE - V & Vergil Alt Colors,TRD,CE EUROPE LIMITED,2020-11-11,dmc5se--v--vergil-alt-colors-playstation-tr,,1,19,,15.2,0
,2023-03-29,"Punch your ticket to a host of incredible DIRT 5 perks and content by upgrading to the Year 1 Edition. Celebrate the festive period in style with the Snow Limits pack for DIRT 5, available for free to all players! Included as part of the latest game update, the Snow Limits pack contains an array of festive new objects to use in DIRT 5's Playgrounds mode, a brand new Sprint race event on the ice at Roosevelt Island, and some fresh customisation options for your profile and liveries, including holiday liveries for the Ford Mustang GT4 and Porsche Cayenne Transsyberia. Year 1 Edition players have instant access to three ready-to-race cars in their garage (Ariel Nomad Tactical, Audi TT Safari, Volkswagen Beetle Rallycross), three-player sponsors with fresh objectives, rewards and liveries, and boosts to currency and XP earnings. After launch, we are committed to developing a massive selection of new show-stopping moments, and new ways to truly Let Loose. Year 1 Edition players get access to all DIRT 5 content in the 12 months after launch, including a minimum of 12 new cars, 60 new Career events, new player sponsors, rewards, liveries, and more! Grabbing DIRT 5: Year 1 Edition ensures you have the keys to everything the boldest, bravest off-road racing game has to offer at launch, and are first in line for everything we create in Year 1! Not only that, but purchase DIRT 5 on PlayStation®4 and receive the enhanced, optimised PlayStation®5 version for free! The PlayStation®5 Digital Edition requires a digital version of DIRT 5 for the upgrade. ",2023-03-14,,https://image.api.playstation.com/vulcan/ap/rnd/202010/2110/8ZEssUZl5TmCSdAV5C8mZuyY.png?w=200,,Playstation,https://store.playstation.com/en-tr/product/EP4001-CUSA16194_00-YRONEUPGRADEBUND,,70%,,Driving/Racing,100.5,https://image.api.playstation.com/vulcan/ap/rnd/202010/2110/8ZEssUZl5TmCSdAV5C8mZuyY.png,,DIRT 5 - Year One Upgrade,TRD,ELECTRONIC ARTS,2020-11-05,dirt-5--year-one-upgrade-playstation-tr,,0,335,,100.5,1
,2023-03-29,"This product is for users who own the DOOM Eternal Standard Edition. This content is available as part of the DOOM Eternal Year One Pass. This product entitles you to download both the digital PS4™ version and the digital PS5™ version. The Ancient Gods – Part One is the first campaign expansion for the critically acclaimed DOOM Eternal. Your war is not over… The legions of Hell have razed the heavens, threatening to expand across dimensions. Battle your way back to Urdak and decide the fate of the cosmos. Your mission is now your own. NEW MISSION Experience a new mission in your eternal fight against evil. Unleash your vengeance and face your greatest test; restore order to the heavens and unearth the corruption that has thrown the universe into chaos. NEW LOCATIONS From the decks of the UAC Atlantica on Earth to the Blood Swamps of Hell to the demon-infested Urdak, you will visit epic new locations to battle the armies of Hell. NEW ENEMIES Change your tactics as you face Hell’s newest threats that add more depth and challenge to combat. Face the demon buffing Spirit and the deadly Blood Maykr.",2023-03-14,,https://image.api.playstation.com/vulcan/img/rnd/202010/1920/IvlVALfssJRGKknn4hATuiiw.png?w=200,,Playstation,https://store.playstation.com/en-tr/product/EP1003-CUSA13275_00-DOOMETERNALDLC01,,60%,,"Shooter, Action",79.6,https://image.api.playstation.com/vulcan/img/rnd/202010/1920/IvlVALfssJRGKknn4hATuiiw.png,,DOOM Eternal: The Ancient Gods - Part One (Add-On),TRD,Bethesda,2020-10-20,doom-eternal-the-ancient-gods--part-one-addon-playstation-tr,,1,199,,79.6,1
,2023-03-29,"This is a standalone product for those who do not yet own the DOOM Eternal Standard or Deluxe Edition. Includes DOOM Eternal (BattleMode). This product entitles you to download both the digital PS4™ version and the digital PS5™ version of this game. The Ancient Gods – Part One is the first campaign expansion for the critically acclaimed DOOM Eternal. Your war is not over… slaying the Khan Maykr left an imbalance of power that threatens all of creation. The legions of Hell have razed the heavens, threatening to expand their control across dimensions. With the aid of an old ally, battle your way back to Urdak and decide the fate of the cosmos. Your mission is now your own. NEW MISSION Experience a new mission in your eternal fight against evil. Unleash your vengeance and face your greatest test as you march back to the Maykr’s realm. Defeat powerful new threats, restore order to the heavens and unearth the corruption that has thrown the universe into chaos. NEW LOCATIONS From the industrial rain-swept decks of the oceanic UAC Atlantica Facility on Earth to the corpse littered Blood Swamps of Hell to the crumbling ruins of a demon-infested Urdak, you will visit epic new locations to eviscerate the armies of Hell. NEW ENEMIES Change your tactics as you face Hell’s newest threats that add more depth and challenge to combat. Face the Spirit, an ethereal enemy that buffs other demons with added strength and speed, and the Blood Maykr – a corrupted Maykr Angel armed with a powerful staff that can be hurled with thunderbolt force.",2023-03-14,,https://image.api.playstation.com/vulcan/img/rnd/202010/1920/pgYETiyZz45f2qO7omKflsGH.png?w=200,,Playstation,https://store.playstation.com/en-tr/product/EP1003-CUSA13275_00-DEANCIENTGODSP01,,60%,,"Shooter, Action",79.6,https://image.api.playstation.com/vulcan/img/rnd/202010/1920/pgYETiyZz45f2qO7omKflsGH.png,,DOOM Eternal: The Ancient Gods - Part One (Standalone),TRD,Bethesda,2020-10-20,doom-eternal-the-ancient-gods--part-one-standalone-playstation-tr,,1,199,,79.6,1
,2023-03-29,"Live by the Blade contains 4 weapons: - Farrier's Fist - Reaper’s Hand - The Rasp - Malice Farrier's Fist Forged in a dying fire, the Farrier’s Fist puts the rough in roughshod. A horseshoe turned-melee-weapon, these improvised dusters have helped more than one Hunter out of a tough spot. Reaper’s Hand More than just a farm tool repurposed as a heavy knife, the Reaper’s Hand gained infamy thanks to its deadly silhouette, striking terror in the heart of timid Hunters. The Rasp Among the cruelest of weapons found in the bayou, pray that when you face The Rasp your killer uses it as a knuckle knife. Its first owner, notoriously cruel, was fond of using it for its original purpose: as a drill. Malice Crafted with rage and wielded with malice, this gruesome combat axe came to be when a desperate Hunter was forced to repair the blade in the field with barbed wire in the midst of a revenge-fueled melee slaughter.",2023-03-14,,https://image.api.playstation.com/vulcan/ap/rnd/202009/2914/IlRxLXxLegFuKg63tRbYDHjU.png?w=200,,Playstation,https://store.playstation.com/en-tr/product/EP4291-CUSA15859_00-THEHUNTGAME00021,,70%,,Shooter,29.7,https://image.api.playstation.com/vulcan/ap/rnd/202009/2914/IlRxLXxLegFuKg63tRbYDHjU.png,,Hunt: Showdown - Live by the Blade,TRD,Crytek Gmbh,2020-10-09,hunt-showdown--live-by-the-blade-playstation-tr,,1,99,,29.7,0
,2023-03-29,"The Kerbal Space Program Enhanced Edition Complete bundle includes the heavily-awarded and ever evolving space simulation game Kerbal Space Program as well as the History and Parts Pack & Breaking Ground expansion for a bundled discount. In Kerbal Space Program, take charge of the space program for the alien race known as the Kerbals. You have access to an array of parts to assemble fully-functional spacecraft that flies (or doesn’t) based on realistic aerodynamic and orbital physics. Launch your Kerbal crew into orbit and beyond (while keeping them alive) to explore moons and planets in the Kerbal solar system, constructing bases and space stations to expand the reach of your expedition. Kerbal Space Program features three gameplay modes. In Science Mode, perform space experiments to unlock new technology and advance the knowledge of Kerbalkind. In Career Mode, oversee every aspect of the space program, including construction, strategy, funding, upgrades, and more. In Sandbox, you are free to build any spacecraft you can think of, with all parts and technology in the game.",2023-03-14,,https://image.api.playstation.com/vulcan/ap/rnd/202008/2609/tvVAG92KJYkYzV17ebvuL5vQ.png?w=200,,Playstation,https://store.playstation.com/en-tr/product/EP4829-CUSA11258_00-KSPEECOMPLETE000,,67%,,"Simulation, Action, Unique",141.57,https://image.api.playstation.com/vulcan/ap/rnd/202008/2609/tvVAG92KJYkYzV17ebvuL5vQ.png,,Kerbal Space Program Enhanced Edition Complete,TRD,TAKE-TWO INTERACTIVE SOFTWARE UK,2020-09-15,kerbal-space-program-enhanced-edition-complete-playstation-tr,,0,429,,141.57,1
